{
  "backend": "native",
  "bounds": {
    "east": 180.0,
    "north": 83.63410065300008,
    "south": -89.99999999999994,
    "west": -179.99999999999991
  },
  "feature_count": 4603,
  "generated_at": "2026-07-14T02:28:15Z",
  "generator_version": "0.1.0",
  "header": {
    "addressed_tiles_count": 11321,
    "tile_compression": "gzip",
    "tile_contents_count": 6872,
    "tile_entries_count": 10443,
    "tile_type": "mvt"
  },
  "layer_name": "ownership",
  "maplibre": {
    "fill_layer": {
      "id": "ownership-fill",
      "paint": {
        "fill-color": [
          "coalesce",
          [
            "get",
            "owner_color"
          ],
          "#b0b0b0"
        ],
        "fill-opacity": 0.78
      },
      "source": "ownership",
      "source-layer": "ownership",
      "type": "fill"
    },
    "source": {
      "type": "vector",
      "url": "pmtiles://official-1836.pmtiles"
    }
  },
  "max_zoom": 7,
  "milestone": "M19",
  "min_zoom": 0,
  "notes": [
    "PMTiles v3 archive of Mapbox Vector Tiles (MVT).",
    "Serve with HTTP range requests or open locally via the pmtiles protocol.",
    "Native backend simplifies per zoom (~1 tile px) and drops sub-pixel features.",
    "tippecanoe is the recommended backend for global sets above zoom 7."
  ],
  "pack_type": "tileset",
  "pmtiles": "official-1836.pmtiles",
  "schema_version": "0.1.0",
  "tile_count": 11321
}
